{"SchemaVersion":1,"ArtifactKind":"approved-runner-state","ApprovedCommit":"aaaaaaaaaaaaaaaaaaaaaaaaaaaaaaaaaaaaaaaa","ToolchainPolicyHash":"bbbbbbbbbbbbbbbbbbbbbbbbbbbbbbbbbbbbbbbbbbbbbbbbbbbbbbbbbbbbbbbb","RunnerTreeHash":"cccccccccccccccccccccccccccccccccccccccccccccccccccccccccccccccc","RunnerRoot":"C:\\approved\\runner","RunnerEntryPath":"C:\\approved\\runner\\scripts\\auto-sync-after-git.ps1","RunnerFiles":[{"RelativePath":"scripts/auto-sync-after-git.ps1","Length":1,"Sha256":"2222222222222222222222222222222222222222222222222222222222222222"}],"ApprovalEventPath":"C:\\approved\\events\\approval.json","ApprovalEventHash":"dddddddddddddddddddddddddddddddddddddddddddddddddddddddddddddddd","ValidatorIdentityHash":"eeeeeeeeeeeeeeeeeeeeeeeeeeeeeeeeeeeeeeeeeeeeeeeeeeeeeeeeeeeeeeee","ScannerIdentityHash":"ffffffffffffffffffffffffffffffffffffffffffffffffffffffffffffffff","ToolCacheRoot":"C:\\tool-cache","GitCommonDirHash":"1111111111111111111111111111111111111111111111111111111111111111","PointerGeneration":1}
